Issue ID,Our Category,Description,Investigation,Resolution,Issue Type
Instantly Skip Dialogue NG,,"This SKSE plugin allows the player character to skip dialogue instantly, bypassing the 750 millisecond delay. This includes dialogue that's normally unskippable (Hermaeus Mora, Molag Bal, Augur of Dunlain, etc.).",,Added.,Mod Addition
Thieves Guild Enhancements ,,Allows you to pay off your bounties at Tonilia. Prevents overwhelming bad luck when it comes to the radiant quests. ,,Added.,Mod Addition
Recipe Auto-Learn    ,,SKSE plugin for Skyrim that makes recipes useful by allowing the player to automatically learn ingredient effects when reading recipes and corrects all recipes to show the correct ingredients.,,Added.,Mod Addition
Fully Harvest Hanging Carcasses and Coin Purses    ,,When you harvest hanging dead animal carcasses they disappear. Harvested coin purses don't have collision. Fixes collision of hanging salmons.,,Added.,Mod Addition
NIF Preview (3D Model Viewer) for Mod Organizer,,Mod Organizer plugin to support previewing NIF files (3D models).,,Added.,Mod Addition
Cooking Categories Improvement,,"Adds thoughtful, zero-conflict sub-categories to the cooking and baking stations through the power of COCKS!",,Added.,Mod Addition
Unique Red Wave,,"Uses Base Object Swapper to change the Red Wave to have its own design, rather than just being a copy of the Dainty Sload.",,Added.,Mod Addition
Regular Quick Save for System Menu,,SKSE Plugin that turns the system menu quickSave option into regular saving. Filled the missing feature in SSE Engine Fix.,,Added.,Mod Addition
Sink of Scrubbing - Interactive Wash Basins,,"Enhances immersion & roleplaying by making washbasins useable, giving you the choice of either grooming yourself or refreshing yourself & provides small buffs to Resist Disease & Speechcraft after cleaning for 4 hours.",,Added.,Mod Addition
Simplicity of Seeding - Better Hearthfires and Farming CC Planter Scripts,,"Make Hearthfire Planters faster, easier to use, and less stupid",,Added.,Mod Addition
Thugs Not Assassins Confrontation,,What's the point in knowing who hired the thugs sent after you if you can do nothing with it? Now you can.,,Added.,Mod Addition
Sweeping Organizes Stuff - Use Broom to Clean Mess,,Use broom to clean up physics mess,,Added.,Mod Addition
Less Ghostly Emperor Crab,,Makes opusGlass's cool overhauled Emperor Crab less ghostly: now with reflections and shadows,,Added.,Mod Addition
Self-targeting Staff Animation Fix,,"Fixes animations for self-targeting concentration, fire and forget, telekinesis, and ward enchantments.",,Added.,Mod Addition
Immersive Display Overhaul,,Say I DO to Vanilla Displays as they always should have been: Select the item you want to display from your inventory instead of needing to equip it beforehand! Light-Plugin,,Added.,Mod Addition
Showing Off Stuff - Put random things on plaques,,"Allow you to put fish, paintings, and some other things on weapon plaques.",,Added.,Mod Addition
Skyland Offset Shingles Fixed - Aligned Whiterun Roofs,,Fix Skyland's misaligned Whiterun roofs,,Added.,Mod Addition
Esbern Voice Consistency Fix,,Replaces Esbern voice lines done by a different actor.,,Added.,Mod Addition
No More Blinding Fog - SSE Port,,"Makes camera-attached fog particles more subtle to prevent conditions where the fog whites out the screen.
SSE port of my 2015 Oldrim mod",,Added.,Mod Addition
Stairs of Skyrim - Windhelm Bridge Stairs,,Replaces snow ramp with stairs. Fixes abrupt snow to stone seam. Mesh-only replacer. No ESP,,Added.,Mod Addition
Say No to Calcelmo,,Allow you to fail Calcelmo's quest and optionally tell him to stop bothering you about Dwarven items in the future.,,Added.,Mod Addition
Simply Order Summons,,"Tell summons to wait, follow, dismiss, or trade",,Added.,Mod Addition
Swiftly Order Squad - Follower Commands UI,,"Swiftly give Orders to your entire Squad of followers, telling them all to wait, teleport to you or access their inventories with a single quick access custom Scaleform menu.",,Added.,Mod Addition
Water Effects Brightness and Reflection Fix,,Fixes bright water effects at night and neon green reflections,,Added.,Mod Addition
Dark Elf Lantern ENB Light,,Adds ENB Light to Dark Elf lanterns,,Added.,Mod Addition
Stones of Solitude - Better Blended Rock Piles,,Replace Solitude rock piles with better blended versions using Base Object Swapper,,Added.,Mod Addition
High Poly Soul Husks,,Higher polygon Soul Husks,,Added.,Mod Addition
Return to Pelagius' Mind,,"Travel back to Pelagius' mind to retrieve items you forgot about. For example, Legacy of the Dragonborn's Jyggalag's Sword",,Added.,Mod Addition
Immersive Death Cycle,,"See dead animals decay over time, eventually turning into bones. Super lite and without any vanilla edits.",,Added.,Mod Addition
Static Swaps Variety - Festival Flags,,"Adds new variants of the Festival Flags static items, using the general colour palette of the hold which they represent , and distributes them throughout the world using Base Object Swapper.",,Added.,Mod Addition
Quest Distribution - More Mine Ore Radiant Quests,,"Enables the vanilla radiant quest Mine Ore for all blacksmiths and miners, and also some citizens in need of ores. The ore that they asks for depends on the location and their specialization, making it very lore-friendly.",,Added.,Mod Addition
Native EditorID Fix,,SKSE plugin that adds/extends editor ID lookup functionality and makes the engine's string formatting safer,,Added.,Mod Addition
Rogue Master Detector,,SKSE plugin that detects and logs rogue masters (plugins which are loaded after plugins which require them as a master),,Added.,Mod Addition
Navigator - Navmesh Fixes,,A few navmesh improvements.,,Added.,Mod Addition
Items Stolen Bug Fix,,"SKSE plugin that fixes a vanilla bug wherein the ""Items Stolen"" Misc Stat is not incremented for stolen container items and coin purses",,Added.,Mod Addition
Pickpocket Reset,,"This mod resets NPC's inventory 40 hours Skyrim time or 7200 seconds real world time after you pickpocket them (if you change your timescale, the time ratio will be different).",,Added.,Mod Addition
Name Those Ash Piles,,Configurable SKSE plugin that changes ash pile names to reflect who they belong to.,,Added.,Mod Addition
Slow Time Particles FX Restored (Script Fix) - Cut Content Restoration,,Restores floating particles for all slow time effects. They were erroneously conditioned out not to apply. It may seem small but the effect is very noticable.,,Added.,Mod Addition
No Grass In Caves,,Simple mod to remove grass in a few caves. ,,Added.,Mod Addition
Torch Bash Ignites Traps,,"This mod allows torch bashing to ignite or trigger environmental traps.
It will also trigger ignitable objects (like Goldenglow's beehives or Summerset's banner) or NPC (like Oil Spiders)",,Added.,Mod Addition
Werewolf Claws Affect Spider Webs,,This Mod Allows the spider web Affect by Werewolf Claws ,,Added.,Mod Addition
Scene Tweak - Roggvir's Execution - Restored Dialogue,,A small tweak which restores some dialogue to the Roggvir execution scene. ,,Added.,Mod Addition
Thalmor Don't Report To Stormcloaks,,Thalmor don't report crimes in holds controlled by Stormcloaks. ,,Added.,Mod Addition
Smart no more stupid dog,," Stops friendly NPC's from saying ""Stupid Dog!"" towards your follower dogs, adopted pet dogs, and dogs friendly towards the Player.",,Added.,Mod Addition
Werewolf Transformation Timer - SkyUI Addon:,,Adds a new widget to werewolf form that shows how long you have left. Compatible with all major werewolf mods. Requires SkyUI and is fully customizable through an MCM. ,,Added.,Mod Addition
Oxygen Meter 2,,"Adds a new oxygen meter to the game for when you are underwater. Using a custom Scaleform menu and SKSE plugin, based off the original Oxygen Meter by PO3. ",,Added.,Mod Addition
PhotoMode,,Take snapshots of your adventures in game with Photo Mode!,,Added.,Mod Addition
Player Eyes Blink Fix ,,"Enables blinking eyes for the player excluding helmets, skse plugin. ",,Added.,Mod Addition
Ice skating fixed for real - No more attack sliding movement ,,"Fixes the infamous long-standing vanilla issue where attacking while slowly moving will make you slide across the ground giving the impression of an ice-skater.1H and 2H covered, NPC and Player. ",,Added.,Mod Addition
Assorted Animation Fixes,,Fixes minor issues with vanilla animations. ,,Added.,Mod Addition
Optimized Meshes - SMIM Chains,,Lower poly meshes for the SMIM chains - NO ESP. ,,Added.,Mod Addition
Trading and NPC reactions for Hunterborn,,"The new dialogue and trading system of Simple Hunting Overhaul, but made compatible with Hunterborn.",,Added.,Mod Addition
Thugs not Assassins,,Hired thugs shouldn't be killing you. That's the Dark Brotherhood's job. ,,Added.,Mod Addition
Simple Fishing Overhaul - Animations and Improved Quest Dialogue,,"Happy Birthday, Skyrim! Fish in third person! Fish in first person! Fish in... second person? Fish in Fish Person! OH, and new lines for the fishing quests and other fishing enhancements!",,Added.,Mod Addition
Scared of Shootings - NPCs react to aiming bows,,"NPCs will react to aiming bows and crossbows by complaining, fleeing, attacking, and reporting you to the guards. ",,Added.,Mod Addition
FYX - RavenRock Docks and Fences Round Posts,,"Smooth the posts of the docks and fences, fix and replace UV's. No ESP ",,Added.,Mod Addition
NPCs React To Invisibility,,"You become invisible in front of people and no one bats an eye... Well, no more! With almost 300+ custom voiced reactions, NPCs will now react to both someone disappearing and someone materializing in front of them. Immersion!",,Added.,Mod Addition
Press E to Heal Followers,,Heal downed companions by simply activating them (provided you have a healing potion with you) and they will react with voiced lines. Immersion!,,Added.,Mod Addition
Show Follower Carry Weight,,Show follower's current carry weight in trading menu.,,Added.,Mod Addition
Windhelm Entrance Offset Fix - Base Object Swapper,,Centers the Windhelm Entrance using Base Object Swapper. No ESP,,Added.,Mod Addition
Sensible Sleepwalking - Wake up at nearest All-Maker Stone,,"Sleep on Solstheim, secure in knowing that you won't get sent to some random other part of the island when you wake up.0",,Added.,Mod Addition
Practical Female Hide Armors,,"Changes the female Hide, Studded, and Scaled Armor to use a similar style to the male versions.",,Added.,Mod Addition
Super Fast Get Up Animation,,Tired of getting gutted when you try to stand? New quick standing up animations for when an actor is knocked off their feet.,,Added.,Mod Addition
Headpart Whitelist,,SKSE plugin that removes unnecessary NPC only/broken headparts from Racemenu,,Added.,Mod Addition
Refracting Ice Form Debris,,"Adds a transparent and refracting effect to the Ice Form debris, which is used by the Ice Form Shout.",,Added.,Mod Addition
Scene Tweak - College of Winterhold Non-Novice spells,,"This mod changes the spells that Savos, Mirabelle and Ancano cast during the scenes in the College of Winterhold quest.",,Added.,Mod Addition
Staves On Self Fix,,This mod fixes incorrect idle animations when using a staff that contains a spell that targets the caster.,,Added.,Mod Addition
Scene Tweak - Thieves Guild Poisoned Mead Scene,,"This scene tweak makes the commander (that tastes the mead in the Thieves' Guild quest, Dampened Spirits) cough during the scene.",,Added.,Mod Addition
Wielding Sun Stuff Hurts Vampires,,This mod causes wielding any anti-undead items or spells to damage you when you're a vampire.,,Added.,Mod Addition
Scene Tweak - Farkas Come Out,,A minor dialogue tweak in which Skjor actually yells somewhat at Farkas to come to him.,,Added.,Mod Addition
No Swing Warnings When Wielding Tools,,"A small mod that prevents NPCs from saying things like ""Hey, watch it!"" when swinging a pickaxe (or other tools) to mine ores.",,Added.,Mod Addition
Scene Tweak - The Book of Love - Calcelmo and Faleen hug,,"This mod makes Faleen and Calcelmo hug, after you have done their part of the Book of Love Quest.",,Added.,Mod Addition
Scene Tweak - No Awkward Laughs,,A small tweak which removes laugh lines in certain scenes.,,Added.,Mod Addition
Only Dead Lovers Cause Inheritance Letters,,"This mod increases the required relationship rank, for inheritance letters to occur, from 1 (friend) to 4 (lover).",,Added.,Mod Addition
State Your Claw,,"Always get the name of the Dragon Claw needed to unlock a puzzle door (provided that the claw actually exists and does have a name), even if a mod's author didn't bother to create a specific message. Requires SKSE",,Added.,Mod Addition
Ulfric...Tullius...Give Me a Break,,"Maybe I'm intolerant, maybe you can't get enough of them, but... this sets a one-week reset time for the never-ending scenes in the Palace of the Kings and Castle Dour, the ones which restart every single time you enter the room. ESP-FE",,Added.,Mod Addition
Sky Haven Shortcut,,"""Secret"" passage for quicker access to the Temple --- ESP-FE",,Added.,Mod Addition
Volkihar Balcony Shortcut,,"A shortcut to and from Volkihar balcony, for those who play without map fast travel. ESP-FE",,Added.,Mod Addition
Vigilants Pursuing Vampire,,"Tweaks the ""Vigilants Pursuing Vampire"" WE quest to suit my taste. ESP-FE",,Added.,Mod Addition
Screenshot Helper NG,,"SKSE plugin which saves screenshots into separate folders for each character, with information about the location they were taken as well as the time and date.

Note: this is a port of Doolum's mod of the same name Screenshot Helper, but with bug fixes.",,Added.,Mod Addition
Requiem - Marksman is a offensive skill MIAOS,,"A simple mod to make Marksmanship (Archery skill) not so useless when compared to one and two handed, ever wondered why at level 50 two handed your character can Sprint power attack with a 40 pound warhammer on their hands but can't walk and shoot an arrow at the same time at 100 Marksman? well this mod is for you.",,Added.,Mod Addition
Fishing Preview,,"Examine, zoom, rotate your catch. Decide if you want to keep it. ",,Added.,Mod Addition
NPCs React To Frenzy,,This mod makes NPCs react to Frenzy/Fury/Mayhem spells. Enemies will be surprised to see their friends turning against them and will say fitting lines. ,,Added.,Mod Addition
Markarth Murder Prevention,,"Moves the attacker's spawn point further away from the victim, giving you more time to prevent a murder. No cells or worldspace records touched, just a single value change to one small record.",,Added.,Mod Addition
Requiem - SPID Apprentice and Novice Perks for All Followers,,TL:DR; A SPID .ini that adds novice and apprentice level Requiem combat perks to all followers.,,Added.,Mod Addition
ELAF Actions Make Noise,,ELAF Actions Make Noise. Have you ever wondered why NPCs aren't alerted when you open chests or doors or activate levers or chains? ,,Added.,Mod Addition
Bethesda Plugin Manager for Mod Organizer,,"Overhauls the Plugins panel in Mod Organizer with new functionality and tweaked visuals.

Notable changes from the vanilla plugin list:
- Record conflicts are indexed and shown with icons and green/red highlights
- Archive conflicts are also shown with cyan/magenta highlights
- Plugins can be grouped together manually or imported from LOOT groups
- Less use of font styles (bold, italic, etc.) on plugin names
- Better visual feedback when attempting to drag plugins to invalid positions
",,Added.,Mod Addition
Lightened Skyrim - Base Object Swapper edition,,Gain FPS across Skyrim with no visual difference! This is the version for Base Object Swapper. ,,Added.,Mod Addition
AWD - Alduins Wall - Descriptions,,This mod adds descriptions to Alduin's wall to identify major events.,,Added.,Mod Addition
Staff Crafting in Skyrim - Court Wizards Have Staff Enchanters,,Adds staff enchanting stations for the court wizards in every major city. ,,Added.,Mod Addition
Hearthfire Extended - Landscape Fixes For Grass Mods patch,,Grass Trim for Lakeview manor (Hearthfire Extended). ,,Added.,Mod Addition
NPCs Take Cover - Smarter Anti-Cheese AI,,"This mod makes NPCs smarter and capable of dealing with the most cheesy strategy Skyrim has ever seen: shooting NPCs from locations they cannot reach. They will now hide properly and relocate if necessary, while also shaming you for using dirty tactics (with 200+ voiced reactions!) ",,Added.,Mod Addition
Lightened ImageSpace Modifiers - Base Object Swapper,,"Removes UNNECESSARY locational imagespace modifications. (Only outside Bleakfalls Barrow right now, but more to come!)",,Added.,Mod Addition
Weapon switch animation Fix,,Fix The Error Vanilla weapon switch movement animation ,,Added.,Mod Addition
Take a Nap - Sleep on Chairs,,"Have you ever wished you could just sleep on a chair? Yeah, me neither. But sometimes there are no beds around and your character needs a nap. Now with animations, back pain and more! ",,Added.,Mod Addition
Just Knock - Simply Knock Dynamic Activation Key patch,,Adapts Chesko's Simply Knock to use Dynamic Activation Key by JaySerpa. Now also supports Simpler Knock by Alaebasta.,,Added.,Mod Addition
VAMPIRE FEEDING TWEAKS﻿,,Adds additional options for vampires to feed.,,Added.,Mod Addition
Andrealphus Scene Tweaks,,"This is a compilation of many different tweaks to scenes to make them more impactful, or restore certain content.",,Added.,Mod Addition
Persistent Favorites,,"You dropped your favorited weapon? You ran out of your favorited potion? This mod will automatically favorite them again, once you have them back in your inventory. No esp/scripts. Install/Update/Uninstall whenever. ",,Added.,Mod Addition
Fair Rebalancing Of Transit Tariffs - Active Graph Evaluation,,"An enhancement to the popular Carriage and Ferry Travel Overhaul mod, with prices based on distance, war, and obstacles to travel.",,Added.,Mod Addition
Sconces of Solitude - Unique Solitude Braziers - Base Object Swapper,,Replaces Nordics ruins braziers and coal piles missing braziers with unique Solitude braziers.,,Added.,Mod Addition
Universal (SKSE) Rim Lighting Fix,,"SKSE DLL that will fix rim lighting (glow) issues with equipped armor, clothing, and creatures.",,Added.,Mod Addition
Swap Consumable,,"Every time you use a potion, drink wine or eat something, the mod will add the empty bottle associated with the type of drink or the rest of the food. The mod is a SKSE plugin, it doesn't use scripts or esp. ",,Added.,Mod Addition
Equipment Durability System NG ,,"Weapons and Armor will be degraded when attacking or taking hits. Weapons and Armor will be randomly tempered, and widgets to display equipment health and what you currently have equipped. A great durability system now moved to CommonLib-NG!",,Added.,Mod Addition
Walking Stick - Walk with staves or polearms - IED-OAR,,,,Added.,Mod Addition
Majestic Dragons - Larger and Immersive Proportions,,"GET YOUR HUGE AND AESTHETIC DRAGONS HERE: Makes dragons larger and improves their proportions to make them more immersive and majestic (larger overall, with much larger wings and tail). Compatible with dragon combat mods, game of thrones dragons, and retextures. Able to aim, and all animations work well. Lightweight, with no performance cost.",,Added.,Mod Addition
Rogue's Gallery,,A miscellaneous papyrus library for personal and public use.,,Added.,Mod Addition
Show Mount Carry Weight,,"Script replacement for Show Follower Carry Weight, so it works with mounts.",,Added.,Mod Addition
Crash Logger SSE AE VR - PDB support,,Generates crash logs when the game Just Works™. This is a SSE/AE/VR port using fudgyduff's MIT source. This can read PDB files that mod authors may distribute. ,,Added.,Mod Addition
Dirty Water Carries Diseases,,"This mod makes swimming in dirty water more dangerous, as it has a change to inflict a disease.",,Added.,Mod Addition
Edmond's Cinematic Dragon Soul Absorption Remastered ESL,,"Remastered and now flagged ESL, absorb dragon souls with a valiant shout and epic build music followed by a cinematic explosion of power. Everything is customizable - vocals can be male, female, or just instrumental. This mod is universally compatible, can be easily installed on new or existing saves.",,Added.,Mod Addition
Spell Research Synthesizer,,"Synthesis patcher made to resolve incompatibilities between different Spell Research patches, plus minor other features.",,Added.,Mod Addition
Perk Adjuster,,"SKSE framework for the manipulation of perk descriptions, positions, and even adding new perks in trees without conflicts. ",,Added.,Mod Addition
Sanctified Stolen Goods,,"You can ask fences around Skyrim to clear the ""stolen"" flag from stolen items. For a price.",,Added.,Mod Addition
Local Map Upgrade,,"An SKSE plugin to overhaul the local maps. Placing custom markers in interiors, color keeping the fog of war, and some other fixes and improvements. Customizable. ",,Added.,Mod Addition
NPCs Learn to Barter,,This mod makes bartering with NPCs take into account their Speech skill and perks to counteract player's bartering skill. No longer bartering is a one-way street :),,Added.,Mod Addition
Hunters Mark Animal Dens on Map,,"Hunters and fishermen can point you to an animal den for a mere fee of 10 gold.
ESL flagged, header version 1.70.",,Added.,Mod Addition
Skypatcher,,"SkyPatcher(also known as RobCo Patcher from Fallout 4), is a patcher based on SKSE and CommonLibSSE, which allows mod authors and users to modify game data without the use of plugins.
You can modify ammos, npcs, races, weapons, modify leveled lists, formlists, containers and more. Easy and fast.",,Added.,Mod Addition
Security Overhaul SKSE - Soul-Cairn Objects Secured,,"Small tweak to add locks to the Soul Cairn chests, as vanilla does not have any.",,Added.,Mod Addition
Perk Adjuster for Skyrim 1.5 ,,Port of Perk Adjuster by SeaSparrow to Skyrim version 1.5.97,,Added.,Mod Addition
Unarmed Hotkey SKSE,,Press a key or controller button to toggle unarmed,,Added.,Mod Addition
No Opposite Gender Animations NG/,,SKSE plugin to dynamically remove the opposite gender anims flag from all NPCs. Compatible with any replacer or custom NPC! ,,Added.,Mod Addition
Dustman's Cairn Farkas Scene Fix,,Fixes an issue that caused the scene with Farkas in Dustman's Cairn during Proving Honor to not play properly.,,Added.,Mod Addition
Fenix Fixes,,"Fenix Fixes, which does these cool features:
1. ""Unstack Stolen Items"" - stolen items now show up as separate entries in the item menu instead of stacking with non-stolen items.
2. ""Health Does Not Kills"" - makes it so you don't die when fortify health potion ends
3. ""Arrow Bounce Fix"" - makes it so your arrows don't unrealistically always bounce back to you.
4. ""Description Enters"" - allow new lines to exist on descriptions instead of only allowing text wrapping
5. ""Smooth Directions"" - smoothes out direction changing animation
6. ""Nerfed Soulgems"" - makes it so small soul gems create lesser enchantments while bigger soul gems create greater enchantments
7. ""Don't Sell Garbage"" - allow constraints to be placed on barter system, such as minimum cost, cost/weight ratio
",,Added.,Mod Addition
Quality of Life Magic,,This is a compilation of my QoL mods for magic. You can enable/disable every feature in the settings. Also you can use json to adjust functions.,,Added.,Mod Addition
Mehrunes Dagon Unique Shrine - Shrine Objects Swapped - Base Object Swapper,,Swaps objects in Shrine of Mehrunes Dagon with unique ones.,,Added.,Mod Addition
More Wash Basins for Vanilla Homes and Taverns,,Adds a wash basin to every vanilla home and tavern that did not already have one. Made for those who use Interactive Wash Basins mods.,,Added.,Mod Addition
Stretched Snow Fix - SSF,,Fixes stretched snow in Skyrim by implementing a simple UV fix.,,Added.,Mod Addition
Model Swapper,,This mod allows you to replace models from the game by a set of other model variations,,Added.,Mod Addition
FYX - Jarl Longhouse - Consistent interior,,Change the central part of the interior of the Jarl Longhouse to be consistent with the exterior. NO ESP,,Added.,Mod Addition
NIF Preview for Mod Organizer 2.5.x,,Mod Organizer plugin that support previewing NIF files (3D models) on mod organier 2.5.2+,,Added.,Mod Addition
Spell Research Synthesizer Various Spells Pack Import JSON,,A bunch of mod patches for Spell Research using Spell Research Synthesizer.,,Added.,Mod Addition
Normal Vampire Face For High Poly Head,,Turning into a vampire will no longer change the head mesh that is used. This prevents becoming a vampire from messing up your character's appearance. Made for High Poly Head.,,Added.,Mod Addition
Requiem - Skooma Fixes Patch,,Fixes for skooma in Requiem.,,Added.,Mod Addition
Quest Fixes,,"Various quest fixes, mostly minor. Bleak Falls Barrow, Battle for Whiterun, The Blessings of Nature, Cidhna Mine, Served Cold.",,Added.,Mod Addition
Sprint Stuttering Fix,,SKSE plugin fixes twitching/stuttering when running in first person.,,Added.,Mod Addition
Missile's IED Preset - Immersive Equipment Displays,,"Presets for Immersive Equipment Display for a various amount of items and some weapon display and gear positioning tweaks. Potions, Instruments, Headhunter's trophies, and Quest Items.",,Added.,Mod Addition
Logical Rope Bridges,,Vanilla bridges contain useless ropes. This mod makes the ropes structural.,,Added.,Mod Addition
Stairs of Safety - Farmhouses,,"This mod simply replaces the “ladder” steps with actual steps and a railing for safety. Mesh replacer, no plugin.",,Added.,Mod Addition
Sovngarde Meshes - FIXES,,A huge collection of fixes for all Sovngarde related meshes.,,Added.,Mod Addition
Katariah Ship Stairs Fix,,Fixes the collision on the Katariah ship stairs,,Added.,Mod Addition
