Issue ID,Our Category,Description,Investigation,Resolution,Issue Type
Loading Menu Overhaul,,A lightweight revamp of Skyrim's Loading Menu that lets you swipe through load screen messages. Compatible with all load screen replacers. SKSE plugin.,,Added.,Mod Addition
Immersive Dying Nurelion - The White Phial Quest,,"Replaces ""Nurelion is asleep and dying"" with more immersive interaction.",,Added.,Mod Addition
Swimming Mount Animation Fix,,Custom mounts often break when you start swimming with them. This is quite annoying as your character will literally start levitating on top of the mount. This mod aims to fix that with a simple workaround.,,Added.,Mod Addition
Solstheim without Miraak - Dragonborn DLC for Non-Dragonborn,,"Miraak's influence only starts affecting Solstheim after the Main Quest ""Dragon Rising"", and intensifies in stages as you progress the Main Quest.",,Added.,Mod Addition
Spell Research JSON Patch,,"Import spells, tomes, and scrolls into Spell Research by adding JSON files to the ""Data\Spell Research"" directory",,Added.,Mod Addition
Spell Research Synthesizer - More Json's,,A bunch of mod patches for Spell Research using Spell Research Synthesizer written for the wildlander modpack.,,Added.,Mod Addition
Simpler Dragon Targeting - True Directional Movement,,"Trim down the number of target nodes on a dragon for TDM's lock-on feature, so you only cycle between the head & body. Only contains a toml file.",,Added.,Mod Addition
Perfectly Valid Wards,,,,Added.,Mod Addition
Explosion Collision Fix,,This plugin aims to fix interactions between projectiles that have an explosion attached and bounding (trigger) boxes.,,Added.,Mod Addition
Weapon Switch Animations Complete,,"This mod aims to fill the gaps left by the base game and Weapon Styles – Draw-Sheathe animations, by adding complete and functional draw/sheathe animations for a wide variety of weapon and hand combinations.",,Added.,Mod Addition
Handcarts - Base Object Swapper,,A bit of a glow up for everyone's favorite cabbage carrier.,,Added.,Mod Addition
Object Impact Framework (OIF),,"A SKSE plugin that lets you add custom effects to items when they are activated, grabbed, released, thrown, or hit. You can make things happen like spawning items, impact data sets, actors, casting spells, creating explosions, playing sounds, and swapping objects - all controlled with JSON files.",,Added.,Mod Addition
Throwing things Makes Noise,,Every wondered why you can grab and throw a metal pot at a NPC while sneaking around and they just ignore it? This fixes that.,,Added.,Mod Addition
Cisterns of Skyrim - A Rain Barrel and Blood Barrel Replacer,,A 4k model and texture replacer for rain/blood barrels. Now with optional BOS addons that make the barrels functional!,,Added.,Mod Addition
JK's Skyrim Better Cranes - Base Object Swapper,,"Replace cranes from JK's Skyrim with Andyross1962's custom model cargo crane.

- Replaces 40-50 separate objects with 1 object, reducing draw calls, improving performance slightly.
",,Added.,Mod Addition
Auto Name Enchantments,,"When enchanting items, the crafted item automatically gets the enchantment's name.",,Added.,Mod Addition
Vampire Headpart fix for High Poly Head and Expressive Facegen Morph,,"I was tired of not finding a fix that works, so I went ahead and made my own. Just as the title suggests. Requires High Poly Head and Expressive Facegen Morphs.",,Added.,Mod Addition
360 Ward,,360° degree full sphere ward replacer.,,Added.,Mod Addition
Retrievable Rods - Lootable Fishing Rods,,"Using Base Object Swapper, turns static fishing rod props into lootable objects. Nice day for fishing, ain't it?",,Added.,Mod Addition
Weapon Stat Viewer V2,,"Display crit, speed, stagger, and reach values for weapon in UI.",,Added.,Mod Addition
Informed Mail Delivery,,"This mod displays the names of delivered items. No required ESPs, no container or quest edits. Works for 1st and 3rd person POV. Compatible with SSE and AE. Versions for vanilla, Provincial Courier Service, and Better Courier. Patch available for Loot and Degradation's tempered item deliveries. Also a version for Your Own Thoughts.",,Added.,Mod Addition
Project Combat Event Fixes - Fix NPCs Stuck in Combat,,"Simple mod that identifies NPCs stuck in combat, based on likely indicating factors, and amends the issue. SKSE Implementation.
",,Added.,Mod Addition
Improved Camera - First Person Animations,,This is an OAR mod designed for use with Improved Camera SE to force vanilla third person movement animations while in first person.,,Added.,Mod Addition
SPID - NFF - Add Ignore Token to CustomAI Followers,,Add NFF Ignore Tokens to custom followers that use their own AI (just another Quality of Life minifix),,Added.,Mod Addition
SKSE Menu Framework,,This mod adds a new dynamic menu to the game that allows SKSE mods to add their own custom pages using the original Dear ImGui api,,Added.,Mod Addition
No Legendary Skills,,Skills cannot be made legendary.,,Added.,Mod Addition
Falkreath Court Wizard,,"Adds a court wizard to Falkreath, which was one of the few only cities lacking one in the base game.",,Added.,Mod Addition
War Hammer and Battle Axe Movement Fix,,A Nemesis mod that fixes the Jank War Hammer and Battle Axe locomotion bug by removing the arm blends,,Added.,Mod Addition
Enemy Load Door Travel Fixes BOS,,"A Base Object Swapper version of my Enemy Load Door Travel Fixes mod. Covers even more doors, all without conflict. May need patching for dungeon location overhauls, but we will see. You can use this new version, or the old one, pick either.",,Added.,Mod Addition
FOMOD Plus - A Mod Installation Overhaul for Mod Organizer 2,,"A total rewrite and overhaul of the FOMOD experience. Show and install previous choices, filter your modlist by FOMOD-installed mods, scan to pre-populate FOMOD content detection, non-blocking, smart-resizing installer window, and more!",,Added.,Mod Addition
Horse Jump Fix,,Mounted jump distance fix,,Added.,Mod Addition
Lock Bashing,,Hit locks to bash them open. Powered by SKSE.,,Added.,Mod Addition
Main Menu Video,,SKSE plugin that replaces your static main menu background with dynamic video and audio.,,Added.,Mod Addition
AOF Warmth and Coverage,,"This mod adds diversity to the warmth and coverage ratings that Frostfall applies to armor.
Now every vanilla, and even mod added armor should have its own unique warmth and coverage rating based on the armor's weight, class, material, and even AR.
I also have modified accessories and weather.",,Added.,Mod Addition
Frostfall Tweaks,,"Make warmth more fun, choose to remove armor when using tent in the cold, and make fiery static objects reduce exposure.",,Added.,Mod Addition
Andrealphus' Harder Quests - Harder Thaneships - Globals Only,,"This mod changes several quests, giving them higher requirements for objectives to be fullfilled.",,Added.,Mod Addition
Ingredient Magnitudes,,In Alchemy menu you'll see the strength of the effects on ingredients.,,Added.,Mod Addition
Clean Crafting,,An SKSE plugin that hides crafting recipes in the UI unless you possess at least one required ingredient.,,Added.,Mod Addition
ConsoleUtilSSE NG,,"Conversion of ConsoleUtilSSE to CLib-NG to create one .dll file that works in all Skyrim SE versions, including AE 1.6.629+.",,Added.,Mod Addition
Alchemy Plus,,"Improves the alchemy system with dynamic models, better item names, and more!",,Added.,Mod Addition
Atlas Map Markers SE - Updated with MCM,,"This is an update to Kronixx's classic mod, Atlas Map Markers. It adds MCM options with full control over the new markers, as well as all of the vanilla map markers.",,Added.,Mod Addition
Atlas Map Markers SE - Updated with MCM - Settings Loader,,"MCM Helper integration for Atlas Map Markers SE - Updated with MCM by kryptopyr. Saves settings as you change them, automatically loads settings on startup or game load, imports settings from an existing save, so you don't have to spend time in MCM again with each game. Localization support. No plugin.",,Added.,Mod Addition
Beard Mask Fix - Beards Use Slot 44 SKSE Plugin at Skyrim Special Edition Nexus - Mods and Community,,Hides facial hair when wearing items using slot 44.,,Added.,Mod Addition
Behavior Data Injector at Skyrim Special Edition Nexus - Mods and Community,,SKSE plugin that allows you to add new animation variables & events via config files without nemesis patch.,,Added.,Mod Addition
C.O.C.K.S. for Skyrim 1.5 ,,"Port of ""Constructible Object Custom Keyword System"" by Parapets to Skyrim version 1.5.97",,Added.,Mod Addition
Cold Region Behavior - Settings Loader,,"Created from scratch MCM for Cold Region Behavior by Maxsu to support MCM Helper. Saves settings as you change them, automatically loads settings on startup or game load, imports settings from an existing save, so you don't have to spend time in MCM again with each game. Localization support. No plugin.",,Added.,Mod Addition
Complete Crafting Overhaul Remastered - Settings Loader ,,"Modified MCM for Complete Crafting Overhaul Remastered by kryptopyr to support MCM Helper. Saves settings as you change them, automatically loads settings on startup or game load, imports settings from an existing save, so you don't have to spend time in MCM again with each game. Localization support. No plugin.",,Added.,Mod Addition
CS' Campfire Item Descriptions,,Adds item descriptions to the misc items from the Campfire mod.,,Added.,Mod Addition
Description Framework - All Books and Notes,,"Description for Books and Notes, 1000+ in total, including all DLC.
Please, don't forget about thumbs up, thank you!",,Added.,Mod Addition
Description Framework - Creation Club,,Gives immersive descriptions to most of creation club' miscellaneous items in form of flavor text.,,Added.,Mod Addition
Description Framework - Food and Drink,,"Gives description to most food and drink from vanilla skyrim and a few mods. More immersion!
",,Added.,Mod Addition
Hunterborn Descriptions,,"immersive UI descriptions covering miscellaneous items in Hunterborn, powered by Description Framework.",,Added.,Mod Addition
Spell Research Item Descriptions,,"immersive UI descriptions covering every miscellaneous item in Spell Research, powered by Description Framework.",,Added.,Mod Addition
Description Framework - Vanilla,,"Adds 400+ immersive UI descriptions covering every miscellaneous item in Skyrim and its DLC, powered by Description Framework.",,Added.,Mod Addition
Description Framework - Various Mods,,Adds descriptions to misc items for over 200+ mods!,,Added.,Mod Addition
DLC2 Miraak BossFightScript Fix,,"Bugs fixes for Miraak Boss Fight Script. Only two edited scripts, no plugin, no requirements.",,Added.,Mod Addition
Dynamic Things Alternative - Base Object Swapper - Settings Loader,,"Created from scratch MCM for Dynamic Things Alternative - Base Object Swapper by wankingSkeever to support MCM Helper. Saves settings as you change them, automatically loads settings on startup or game load, so you don't have to spend time in MCM again with each game. Localization support. No plugin.",,Added.,Mod Addition
Honed Metal - Settings Loader new,,"Modified MCM for Honed Metal -NPC Crafting and Enchanting Services- by SkylineR390 to support MCM Helper. Saves settings as you change them, automatically loads settings on startup or game load, imports settings from an existing save, so you don't have to spend time in MCM again with each game. Localization support. No plugin.",,Added.,Mod Addition
Hunterborn - Scrimshaw Expanded UNP Meshes,,Adds hundreds of new recipes and items to Hunterborn's Scrimshaw feature.,,Added.,Mod Addition
I'm Fishing Here,,Simple patch to make suspicious city guards not stalk you when you're fishing,,Added.,Mod Addition
Improved Traps - Nether's Follower Framework Bear Trap Fix,,Fixes a conflicted script between kryptopyr's Improved Traps and Netherworks' Nether's Follower Framework mod. Requires both! Don't install it if you don't use both!,,Added.,Mod Addition
Keyword Patch Collection,,"My collection of patches, fixes, and tweaks for keyword related stuff. Utilizes Keyword Item Distributer and Object Categorization Framework where possible.",,Added.,Mod Addition
LeveledList Crash Fix,,"Simple SKSE mod that prevents AddForm from adding forms to leveled lists with 255 items, preventing crashes.",,Added.,Mod Addition
LOD Unloading Bug Fix - Settings Loader,,"Created from scratch MCM for LOD Unloading Bug Fix by wankingSkeever to support MCM Helper (+hotkey for Fix LOD button). Saves settings as you change them, automatically loads settings on startup or game load, imports settings from an existing save, so you don't have to spend time in MCM again with each game. Localization support. No plugin.",,Added.,Mod Addition
Missives - Settings Loader,,"Created from scratch MCM for Missives by IronDusk33 to support MCM Helper. Saves settings as you change them, automatically loads settings on startup or game load, imports settings from an existing save, so you don't have to spend time in MCM again with each game. Localization support. No plugin.",,Added.,Mod Addition
Wildlander Patches and Bugfixes,,"Various patches and fixes for mods primarily to be used in the Wabbajack Wildlander Modlist.

Some have utility for others.",,Added.,Mod Addition
Nether's Follower Framework ,,"Nether's Follower Framework is a multi-follower system that is light on game resources and allows for up to 10 companions at one time. It provides a wealth of additional features, including immersion and quality-of-life functions to allow you to adventure with a small team of characters.",,Added.,Mod Addition
Nether's Follower Framework - Legacy Settings Loader,,"Adds the ability to automatically loads saved settings at startup for Nether's Follower Framework by Netherworks, so you don't have to spend time in MCM again with each new game. ESPFE plugin. NO NEW GAME NEEDED.",,Added.,Mod Addition
No Nasty Notes - A Wildlander Patch,,A patch for Wildlander: Removes the ugliness in the basement of Fort Greenwall.,,Added.,Mod Addition
No Snow Under the roof - Hall of the Vigilant fix,,This Mod tries to fix several bug’s still present in “No Snow Under the roof” Mod v3.2 by Prometheus.,,Added.,Mod Addition
Open Animation Replacer - IED Conditions,,A SKSE64 plugin that adds new conditions to Open Animation Replacer for use with Immersive Equipment Displays and Simple Dual Sheath.,,Added.,Mod Addition
Pandora Behaviour Engine Plus,,"Behaviour engine tool for patching Skyrim Nemesis/FNIS behaviour mods, with full creature support. Clean, responsive UI and error-tolerant, verbose patching. Supported on Windows/Linux/MacOS, open source and intended as an alternative to Nemesis.",,Added.,Mod Addition
R.A.S.S. Rain Ash And Snow Shaders - Wet Frost Cold Dust - Settings Loader,,"Created from scratch MCM for R.A.S.S. Rain Ash And Snow Shaders - Wet Frost Cold Dust by lKocMoHaBTl to support MCM Helper. Saves settings as you change them, automatically loads settings on startup or game load so you don't have to spend time in MCM again with each game. Localization support. No plugin.",,Added.,Mod Addition
Simple Portable Cooking,,A simple mod that lets you cook at a campfire or another heat source by using the cooking pot directly from the inventory.,,Added.,Mod Addition
Spell Research - Experience Book,,"This is an extension of the Spell Research Mod by IronDusk33 and requires it to function.

It displays an in-game book with the experience levels that you gain through Spell Research's methods.

For each Archetype, a lore-friendly image is shown in the book once you gain any experience in that Archetype.",,Added.,Mod Addition
Spell Research Intuition - Thesis Studying and Recycling,,Let your intuition guide you in your research.,,Added.,Mod Addition
Spell Research - Convenience Add-On,,"Adds a few quality of life improvements and features to the Spell Research mod by IronDusk33 – refining recipes for large amounts of solutions, easier way of dealing with mental exhaustion, a way to transform ruined books to paper, sitting animations, and more.",,Added.,Mod Addition
Spell Research - Experience Book Enhanced Graphics,,Retexture for Spell Research Experience Book mod,,Added.,Mod Addition
Spell Research Synthesizer - More Json's - Wildlander,,A bunch of mod patches for Spell Research using Spell Research Synthesizer written for the wildlander modpack.,,Added.,Mod Addition
Sleep Tight SE - Settings Loader,,"Created from scratch MCM for Sleep Tight SE by toostruus to support MCM Helper. Saves settings as you change them, automatically loads settings on startup or game load, imports settings from an existing save, so you don't have to spend time in MCM again with each game. Localization support. No plugin.",,Added.,Mod Addition
Contextual Crosshair - Crosshair and Detection Meter Fix,,This should fix the crosshair disappearing bug and also the flickering with Detection Meter.,,Added.,Mod Addition
Skyrim 3D Misc Chopping Block Texture Map Fixes,,"Fixes an issue with Skyrim 3D Misc by mathy79, wherein chopping blocks in snowy/ashy areas (and those used for execution) are remapped with vanilla textures that do not work with the new mesh's UV map. New textures for snowy chopping blocks, ashy chopping blocks, and bloody chopping blocks, and a plugin that maps them.",,Added.,Mod Addition
Mcm Helper Visualizer,,"McmHelper Visualizer simplifies McmHelper development by letting mod creators preview custom menus without launching the game. Streamline menu creation with real-time JSON previews, ""groupControl"" simulations, and translation file integration. Boost your modding efficiency!",,Added.,Mod Addition
WL-1602 - Open Customization Pipeline,Documentation,All tasks for re-opening customization,,"Wiki updated, Discord updated. Announcement made.",Website
WL-1388 -  infinite Guild Master's Armor and super power lvl for pick pocking,Exploit,"Type of Bug: Exploit
  Detailed Description**
so when you have a high enouth pickpocket you can go to vex when she sleeping and steal her armour then wake her up then let he sleep again then take it agen this both lvl up your pickpocket and give you multiple amours 




*Additional Information*


https://youtu.be/g51k8lTC1bk

*User Info*
Customised Install: No   
Preset 
Version: Wildlander 1.1.5 (Curent)
Reproducable:Yes",,"I populated Vex’s sleep outfit with {{DefaultSleepOutfit}}, which would hopefully prevent her from wearing her armor while sleeping (and therefore replenishing it if it is pickpocketed).",Resolved By Linked Issue
WL-239 -  Followers teleport forward too close,Follower,"1. Acquire a follower and horse (in this case, Erik the Slayer was used)
2. Ride the horse through the world, outpacing your follower 

Result: Follower will teleport up to the player, slightly above the ground (0.5 meters), and fall back down","'- Follower will teleport up to the player, slightly above the ground (0.5 meters), and fall back down
To resolve this issue, increase the distance from the player that they teleport to. For example, instead of followers teleporting and appearing within 2 meters of the player, increase this to 5 meters (so it occurs outside of the viewable camera while on horseback)
",Closing because Follower live package has been removed.,Resolved By Linked Issue
WL-891 - Taught follower the spell Sunfire through the dialog. They use it in combat even on enemies which aren't undead and they seem to prioritize using only that. ,Follower,"I used Erandur. 

Teach a follower Sunfire. Maybe only reproduces if they are perked high in restoration? 


",,Issue is no longer applicable as Follower Live package has been removed. ,Resolved By Linked Issue
WL-1911 - neck seams on random NPCs,Visuals,"My character looks fine, named NPCs look fine, but bandits look like this. I even reinstalled to try and fix it.

kleater
OP
·
2 days ago
Alright so I uninstalled, reinstalled again, started a new game in whiterun and headed straight for Greymoor, Khajit look like his. https://imgur.com/7kD0G6i

level 1
kleater
OP
·
2 days ago
just to check for sure it isn't the blood causing this, I went to the same location, and tried removeallitems on one of the bandits, same issue. https://imgur.com/a/ScOPzEE","Confirmed myself on fresh install - all but 1 Bandit NPC at fort greymoor generated with a neckseam (screenshot 216 below is mine)  Image.png is the User's

Seems to be Face discoloration fix ""nearly"" fixing them - with FDF disabled - they all go blackface (screenshot 217) Regenerating facegens will probably fix this ?",Regenerated NPC facegen.,Resolved By Linked Issue
WL-118 -  Characters have visible neck seams under certain weather conditions. ,Visuals,"1. Launch Ultimate Skyrim via Mod Organizer 
2. Proceed through Character Creation
3. In-world, use the console to change to an Overcast type of weather. 
4. Observe the character's neck. 

*RESULT* There will be a visible seam. 
",same issue as WL-1911,same issue as WL-1911,Resolved By Linked Issue
WL-252 -  Dawnstar Well missing refill bottles activator,Gameplay,As with Windhelm. the well next to the Jarl's longhouse in dawnstar is missing refill bottles activator,"See Linked issues.
ETAC patch needed for this well.",See WL-222 Issue for fix,Resolved By Linked Issue
WL-364 - Bathing Facilities at College - Suggest adding a trapdoor to bathe in the students tower ,Bug & QOL,,Please see Linked issue for fix.,Resolved By WL-675,Resolved By Linked Issue
WL-410 - Proudspire manor - Bar area. Odd Mead crate texture.,Homes,,See Linked wl-407,See Linked wl-407,Resolved By Linked Issue
"WL-512 -  Captain Valnir does not accept a Missive quest item, the only conversation options available with him are about his quest to go meddle with a dragon priest.",Quest,"Took Missive quest ""Retrieve heirloom from Honeystrand Cave"" in Riften. Grabbed the heirloom (ring) in the Honeystrand Cave. Quest marker tells you where Captain Valnir is in the mountains near Riften. Captain Valnir has no dialogue option to take the heirloom (ring) from you and complete the quest.","ValmirBASE ""Captain Valmir"" [NPC_:0007E5B4]
ValmirSons [NPC_:0007E5B5]
ValmirImperial [NPC_:0007E5B6]


All need adding to the missive and hired muscle exclusions lists.",See Wl-1654 for fix,Resolved By Linked Issue
WL-598 -  Speechcraft allows Fencing of stolen goods.,Exploit,,Recommend just disabling the barter skill - causes more issues. See linked.,Resolved by Wl-1958,Resolved By Linked Issue
"WL-602 - In Anga's Mill near Windhelm is a place to cook outside, that can't be interacted with",Gameplay,,"Have confirmed. Cooking pot looks OK in CK.. but in game it cannot be used. Suspect collision marker is preventing the activation, and havok is making the other pot wonky on the spit.

Fix is attached to ticket 1638 / WL-490",See Wl-464 for fix,Resolved By Linked Issue
WL-641 -  When i went to bath in a river on the way to riften it teleported me all the way back to whiterun entrance ,Gameplay,,See Wl-587,See Wl-587 for Fix,Resolved By Linked Issue
"WL-651 -  Horse wearing the armor I put in his inventory, humanoid armor.",Gameplay,,Vanilla behaviour! Pretty sure this is because the horse is a follower - and followers wear the best armor in the inventory,"Added Item Equip restrictor to prevent horses wearing player armor, or players wearing saddles. See Wl-1672",Resolved By Linked Issue
"WL-691 - Crafting gear at the forge grants no smithing experience; tried with several different types of leather equipment, and reloaded older saves. Smithing is level 4 and I have the first perk (but have since sold the book).",Crafting,,Most likely the switching stations bug from CCOR,"Most likely the switching stations bug from CCOR.
Will be resolved by WL-1102",Resolved By Linked Issue
"WL-700 - When using the forge in breezehome, no experience is given for creating anything",Crafting,"Might be related to WL-997
","This is caused by moving workstations to quickly. E.g moving from tanning rack to forge.

The updated version of CCOR should fix this - but we would need to migrate our script changes over.",See Wl-1102,Resolved By Linked Issue
"WL-708 - Placing a wooden barrel and subsequently picking it up only adds the barrel weight. If you put 5k pounds of items in it and pick it up, it weighs 15 pounds. I would assume all ""placeable"" storage furniture is the same.",Gameplay,,See linked mod,See Wl-1936 for Fix,Resolved By Linked Issue
"WL-732 - The nosy guard in windhelm followed me from the docks to Solsthiem when I took the boat, and he was just standing on the boat, stuck.. forever..",Gameplay,,see linked issue,See Linked Wl-634,Resolved By Linked Issue
WL-811 - Grey Fell Ponies spawning on my location randomly out of thin air while being in Dawnstar.,Horse,"Just running around doing my stuff and suddenly horses are spawning on my head.

",See Linked Issue,See linked issue Wl-841,Resolved By Linked Issue
