Issue ID,Our Category,Description,Investigation,Resolution,Issue Type
WL-1541 - If you take a stone of barenziah it counts as stealing ,Gameplay,"It says take but it is stealing. You have no way to expect it is stealing when it says take.

GO to a public stone of barenziah such as companions and ""take"" the stone","This is a setting in thieves guild requirements MCM > Misc options. 
Mark as steal. What it does is makes taking the items set of steal alarms but **doesnt** change the take to a steal on the tooltip.

we either need to fix it so the items are properly marked or turn off the option.","This is a setting in thieves guild requirements MCM > Misc options. 
Mark as steal. What it does is makes taking the items set of steal alarms but **doesnt** change the take to a steal on the tooltip.

Set Mark as steal for stealing gems to off",Setting Change
WL-76 - Allow use of crafting stations while in combat,Mod Setting Change,,"Po3 tweaks v 1.7 onwards now has a update to allow use of furniture in combat

We should just need to update and enable it :)",Enabled setting.,Setting Change
WL-1707 - Character creation using one of the preset classes (Acrobat or agent i cant remeber which) spawned me without any weapons at all,Character Creation / Races / New Game,"When testing dark missives i picked one of the classes from the first page - Honestly cant remeber if it was agent or acrobat. when checking inventory i had no weapons.

should at least spawn with a dagger!",,Added logic to character creation to give players a dagger if they didn't select one or two handed as background skills.,Bug
WL-1671 -  my game freezes and then sends me back to desktop randomly. 0x1B800000000,CTD/Freeze,"My game randomly crashes while walking around ive crashed walking out of whiterun and walking on the road near falkreath 
","Possibly Bad facegen? 

this is another crash involving [SP+360]  0x1B878D87B00      (BGSHeadPart**) -> (Name: MaleEyesHumanDemon `MaleEyesHumanDemon`, FormId: 0002425E, File: `Skyrim.esm`)
",Facegen's have been regenerated which hopfully resolve this issue,Bug
WL-27 -  ETaC / JK items don't have ownership,Items,,, ETaC / JK have been removed,Bug
WL-237 -  Janus Mentedius in Farmer's Bounty Mercantile in Rorikstead is missing a voiced greeting.,NPC,"Cell: Farmer's Bounty Mercantile
NPC: Janus Mentedius
Reproduction: Go inside the shop, he will greet you, proven by the subtitles, but no voice line",Version 0.7 of ETAC *may* fix this. the notes indicate his voice lines were cleared up., ETaC / JK have been removed,Bug
WL-424 - Dawnstar Carrige driver clip,NPC,"Dawnstar carriage driver standing inside the carriage
*Steps to reproduce:*
Go to Dawnstar, find the carriage
*If you have supporting screenshots and/or videos - Please give us link(s). Please note: if reporting a graphical bug you must include a screenshot of your map location, and a screenshot of the console with the item selected.*
","i *think* this is related to the ETAC CTFO patch 

Re-opened Happens everytime in my game if you walk/ride into Dawnstar from say windhelm - Corrects itself on exit. Really fucking weird bug!", ETaC / JK have been removed,Bug
WL-1032 - Forts of Skyrim Rebuilt interior cells do not have proper ELE lighting,Environment,,,Forts of skyrim has been removed.,Bug
WL-1266 -  Merchant Trader Orc of Dawnstar (Oorlung?). His first line of voice when entering his shop is always silent. ,NPC,"Enter Dawnstar General Traders shop when shopkeeper orc is present
",Version 0.7 of ETAC *may* fix this. the notes indicate his voice lines were cleared up., ETaC / JK have been removed,Bug
WL-1709 - Stray Spiky Grass Pod in Markarth city stream,Environment,"There is a harvestable spiky grass pod in the stream that runs through Markarth's entrance square.

*Additional Information*
Go to Markarth and look in the stream by one of the small bridges. It's difficult to notice, from above, but it's obvious if you clip under the ground and look up.


",, ETaC / JK have been removed,Bug
WL-1979 - Riverwood apothecary won't talk,NPC,"If you talk to the Riverwood apothecary/potion man once in his shop and then close out of the dialogue menu, you can't talk to him again without reloading the game. The conversation options appear but you can't select them. This can be annoying when you buy ingredients from him, make some potions, and then try to sell them to him; you can't actually select any of the conversation options. ",, ETaC / JK have been removed,Bug
WL-1821 - Male dunmer look terrible. ,Character Creation / Races / New Game,"Starsight skins needs reinstalling using the ""younger"" option See https://airtable.com/app6IMUkhDQiSdL0B/tbln0wE3ffVnUk2ML/viwGFdBIx5NoRNxBU/recEQVnLSDr54pECM?blocks=hide
",,Reinstalled using the Younger skin variant.,Mod Update
Sleep Tight SE Fixes,,"Fixed armor slots in Naked and Robed forms, NPCs now will unequip all armor parts. Added compatibility for Yundao Hair and KS Hairdos HDT.",,WL-1712 - Fixes the magic respawning armor when pickpocketed.,Mod Addition
Improved Closefaced Helmets - Fixes,,Fixes for Improved Closefaced Helmets.,,Added to fix WL-1610 -  Daedric helmet - no face,Mod Addition
DLC2PillarBuilderActorScript Tweak,,"Overhauls the DLC2PillarBuilderActorScript from scratch for better performance, by making it only update when necessary and expands on its features for a more comprehensive behavior handling. No ESP.",,Added for WL-1841 - Scripts Carefully Reworked Optimized and Tactfully Enhanced (SCROTE) - Simply Optimized Scripts AIO ,Mod Addition
NPC AI Process Position Fix NG,,"Updated NPC AI Process Position Fix adding support for SE, AE, and VR in one DLL.",,Added So NPC's move while you are waiting,Mod Addition
Outlaw Refuges - Base Object Swapper,,Swaps a lot of the static clutter items inside of the outlaws refuge with stealable containers or lootables.,,Added for WL-168. Swaps a lot of the static clutter items inside of the outlaws refuge with stealable containers or lootables.,Mod Addition
Gesture Animation Remix (DAR),,"(aka ""Dialogue Animation Remix"") Adds over 50 dialogue gesture animation variants according to NPCs personality, role in society and by armor type. Works with custom followers and NPC from mods as well as vanilla. Dynamic Animation Replacer folders with .hkx animations - no esp/esl!",,Makes NPCs more expressive during dialogue by expanding their body language which depends on their background.,Mod Addition
Holidays Happy Little Trees Patch,,Stops Holiday's lanterns floating in mid air with Happy Little Trees,,Added for WL-1624 - Floating lanterns in Solitude,Mod Addition
dunFolgunthurBossBattle Script Fix,,Fixes a vanilla bug which can cause the Folgunthur boss fight to get stuck in your save running forever and retroactively stops it if it's already stuck. No ESP.,,Added for WL-1841 - Scripts Carefully Reworked Optimized and Tactfully Enhanced (SCROTE) - Simply Optimized Scripts AIO ,Mod Addition
Inconsequential NPCs Carriage Guard fix,,Allows the Carriage guards to spawn no matter the carriage mod used.,,Added to fix WL-1613. Allows the Carriage guards to spawn no matter the carriage mod used.,Mod Addition
World Encounter Hostility Fix,,Prevent vanilla world encounter NPCs from turning hostile when you cast non-hostile spells,,Added to fix WL-1725 ,Mod Addition
Featherstone's Repository (adds more wells),,Specifically Sunhelm patches for well ,,Fix for WL-222 -  Windhelm Wells have no buckets,Mod Addition
Skyrim 3D Misc Chopping Block Texture Map Fixes,,"Fixes an issue with Skyrim 3D Misc by mathy79, wherein chopping blocks in snowy/ashy areas (and those used for execution) are remapped with vanilla textures that do not work with the new mesh's UV map. New textures for snowy chopping blocks, ashy chopping blocks, and bloody chopping blocks, and a plugin that maps them.",,Added to fix WL-1135 -  bloody chopping block has scuffed texture,Mod Addition
Scripts Carefully Reworked Optimized and Tactfully Enhanced (SCROTE) - Simply Optimized Scripts AIO,,"A collection of all my vanilla game script fixes in a single, easy to install package.",,Added for WL-1841 - Scripts Carefully Reworked Optimized and Tactfully Enhanced (SCROTE) - Simply Optimized Scripts AIO ,Mod Addition
Simple Campfire Additions,,Adds a few additional craft-able items under the Create Item option in Campfire such as more furniture and workbench options.,,fix for WL-1742 - Missing furnature stations/activators for camping,Mod Addition
DLC2MiraakScript Fix,,"Fixes the DLC2MiraakScript to not take up all of the game's scripting resources and wrecking the scripting engine in the process, by reworking a very inefficient while loop. No ESP.",,Added for WL-1841 - Scripts Carefully Reworked Optimized and Tactfully Enhanced (SCROTE) - Simply Optimized Scripts AIO ,Mod Addition
Conditional tavern cheering (DAR),,"No esp/esl! 4 new applause animations and 3,5 new ways of cheering while bard sings. DAR folders by NPC demographic, voice types, worn armor to add personality to taverns guests. Sam Guevenne included!",,Added so that everyone who cheers does it differently rather than the entire tavern using the same one.,Mod Addition
XP32 Lite - Script free,,This mod remove all the weapons and scales related scripts and the mcm from the esp. This mod is just for the people who use SOS OR the people who need the fnis file from nemesis to regenerate. Mods like stances needs the fnis file.,,To remove the requirement for XPSME Scripts (to prevent the user getting confused with why their weapons move from where they put them in racemenu),Mod Addition
Sound Fix for Large Sector Drives,,Skyrim's engine has a bug that causes audio to not play most of the time when the game is installed to a drive with a sector size other than 512 (usually referred to as Advanced Format). This is an SKSE plugin that fixes the bug. Compatible with all versions of SE/AE.,,Added for WL-1756 - Sound Fix for Large Sector Drives,Mod Addition
EVG Conditional Idles ,,"Handmade animations that only play in specific conditions. Unintrusive, no gameplay changes.",,Added to give the player character some visual clues of the magic/stamina status if you play hudless,Mod Addition
DLC2AudioRepeaterActivator01Script Tweak,,Reworks the DLC2AudioRepeaterActivator01Script to fix a few bugs with its implementation and improve performance. No ESP.,,Added for WL-1841 - Scripts Carefully Reworked Optimized and Tactfully Enhanced (SCROTE) - Simply Optimized Scripts AIO ,Mod Addition
Lively Children Animations (DAR),,Makes kids childish: adds more than 10 idles and 10 dialogue gestures and other animations variants + secret bonus animation specifically to children. No esp/esl plugin - just Dynamic Animation Replacer folders. Safe to install or delete mid-playthrough - try and see for yourself!,,Added to give children's animations some more vareity,Mod Addition
Unaggressive Dragon Priests Fix,,This is my attempt at fixing unaggressive dragon priests.,,Added to fix WL-1577,Mod Addition
Train And study - Lost Library,,"Simple patch to add the Skill books added by Book covers - Lost Library to Train and study's ""study book"" Skill",,"Added for WL-1560. Simple patch to add the Skill books added by Book covers - Lost Library to Train and study's ""study book"" Skill",Mod Addition
"Obscure's College of Winterhold NPC Stuck in Staircase Fix
",,Fixes bug in Obscure's College of Winterhold where NPCs get stuck in the staircase between The Hall of Elements and The Arch-mage's Quarters,,Fixes bug in Obscure's College of Winterhold where NPCs get stuck in the staircase between The Hall of Elements and The Arch-mage's Quarters,Mod Addition
Open Animation Replacer,,A SKSE framework plugin that replaces animations depending on configurable conditions. In-game editor. Backwards compatible with more features. Extensible by other SKSE plugins. Supports SE/AE/VR. Open source.,,Removed DAR and replaced with OAR,Mod Addition
No More Silver In Castle Volkihar,,"Removes all silver paraphernalia from castle Volkihar using Base Object Swapper and AnimObjectSwapper. Vampires and thralls will no longer use trays filled with dangerous silver or silver cups when emoting, either.",,"Added for WL-1740. Removes all silver paraphernalia from castle Volkihar, Vampire Lairs & Jorrvaskr ",Mod Addition
DLC2dunSeekerInvisScript Fix,,Reworks the DLC2dunSeekerInvisScript to improve performance and prevent FPS drops by replacing an inefficient while loop with RegisterForSingleUpdate. No ESP.,,Added for WL-1841 - Scripts Carefully Reworked Optimized and Tactfully Enhanced (SCROTE) - Simply Optimized Scripts AIO ,Mod Addition
Weapon Styles - Draw-Sheathe animations for IED,,"Utilizing Open Animation Replacer, this mod will provide you with equip/unequip animations to be used with Immersive Equipment Displays.",,"Added for WL-1331 - xp32 does not need scripts, IED fixes contained inside",Mod Addition
Alchemy Plus,,Port of Alchemy Plus by Parapets to Skyrim version 1.5.97,,"Impurities in potions and poisons will now subtract from the item's value instead of add to it. 

You will no longer earn much experience or gold from making them.",Mod Addition
Keep It Clean - OCW Patch,,Adds a magical bathhouse to the College of WInterhold.,,Added for WL-675 - There isn't anywhere (that I can see) to bathe in the College Of Winterhold.,Mod Addition
Battle Ready Candlelight Fixes,,"Candlelight positioned for tactical combat, Removes the particle cloud, Fixes 1st/3rd person brightness differences.",,"Added to fix WL-915 - CandleLight spell is brighter/darker in 1st/3rd person, at night",Mod Addition
NPC Animation Remix (DAR),,"Scratching head animation, pulling pants, pondering, checking pockets in Riften... 22 idles for NPCs with appropriate conditions using DAR folders and big amount of less noticable animations to fix inconsistencies: prevents NPCs from standing synchronized, for example. Works with NPCs added by mods as well as vanilla. No esp/esl!",,Added more idle animations for NPCs. All are immersive and reflect situations they're in.,Mod Addition
Barter Limit Fix,,"SKSE plugin that fixes trading with merchants with more than 32,767 gold.",,Added for WL-1736 - Barter Limit Fix,Mod Addition
End Inappropriate Afflicted Encounters SE,,"Eliminates the constant afflicted random encounters once your character has interacted with an afflicted refugee or started ""The Only Cure"" quest. ESL-flagged.",,"Added To fix WL-716. Eliminates the constant afflicted random encounters once your character has interacted with an afflicted refugee or started ""The Only Cure"" ",Mod Addition
First Person Animation Teleport Bug Fix,,"Behavior patch that fixes a vanilla bug where starting certain interaction animations in first person teleports you to the start of the cell you were in. Clean, compatible, and lightweight.",,"fix for WL-587 - When successful in composing a spell, I teleport to Whiterun gate (external) and linked issues.",Mod Addition
Pristine Vanilla Movement,,"Updated run, walk & sprint animations edited from vanilla. Removes jitters, bouncier, smoother, more casual looking.",,"Updated run, walk & sprint animations edited from vanilla. Removes jitters, bouncier, smoother, more casual looking.",Mod Addition
Improved Camera SE,,Improved Camera is an SKSE plugin that enables the 1st person body and allows for typically forced 3rd person animations also to be played in 1st person.,,Updated to current release version Improved Camera SE v1.1.1,Mod Addition
Campfire Collectable Deadwood and Branches,,This Campfire addon allows you to collect coastdriftwood and reachbranchpile and use the deadwood and branches obtained to light a campfire. ,,Added so you can collect usable wooden clutter from beaches.,Mod Addition
EVG Animation Variance,,"Adds variety to existing animations, through NPC personality types, conditions, or just randomly.",,"Adds variety in currently existing animations based on NPC personality types, conditions, or just randomly, to make Skyrim feel a bit more diverse.",Mod Addition
Skysight Skins,,"The classic comes to SE! Completely new, digitally hand-painted textures, specular maps, and re-worked normal maps for all non-beast male races AND REAL FEET MESHES. True to vanilla style, extremely high detail, highly optimized. Includes both face and body textures, with alternate options for body hair, and dirt. 4K/2K/Performance.",,Updated to use the Younger version to fix WL-1821 - Male dunmer look terrible. ,Mod Addition
DLC2dunFrostmoonTriggerScript Optimization,,Reworks the DLC2dunFrostmoonTriggerScript to not check repeatedly if you're near the camp by replacing an inefficient event with RegisterForSingleUpdateGameTime. No ESP.,,Added for WL-1841 - Scripts Carefully Reworked Optimized and Tactfully Enhanced (SCROTE) - Simply Optimized Scripts AIO ,Mod Addition
Fort Greenwall Forge Fix,,Fixes the placement of the blacksmith forge at Fort Greenwall.,,Fix for WL-422 -  Forge at Fort Greenwall is half inside the exterior wall,Mod Addition
Immersive folded hands (DAR),,"No esp/esl! Adds 5 short idles with folding hands for NPC and makes standard ""folded hands"" animation overlay (offsetarmscrossed.hkx) less probable by adding 12 new variants according to NPCs armor type, personality or role in society. Works with NPC from mods as well. Dynamic Animation Replacer folders with .hkx files",,"Added to give some variety of ""folded arms""",Mod Addition
Vanargand Animations,,"Hi gamer, welcome to my Nexus profile where I share my collection of mods, feel free to pick and choose any that suit your taste. As none of them require the other, you can mix and match them With different animations from different authors as you see fit.
 
It is completely safe to install/uninstall any of them anytime during your playthrough.
 
""Vanargand"" is for light character playstyles e.g. One-Handed, Dual Wield, Archery etc.
 
",,Added,Mod Addition
DLC2dunNchardakDoorSeal Script Infinite Loop Fix,,Fixes the DLC2dunNchardakDoorSeal script to not enter an infinite loop when used by mods and stops currently stuck instances. No ESP.,,Added for WL-1841 - Scripts Carefully Reworked Optimized and Tactfully Enhanced (SCROTE) - Simply Optimized Scripts AIO ,Mod Addition
Combat Music Fix NG,,Simple SKSE plugin to fix the never-ending combat music bug.,,Added fix for WL-607,Mod Addition
Constructible Object Custom Keyword System (COCKS),,Improves the usability of the Constructible Object Menu with SkyUI with an extensible keyword-based category system.,,Added to help with WL-1339 - Approaching Eorlund Gray-Mane about placing a crafting order and proceeding to scroll through the items causes a CTD after a random interval of time ,Mod Addition
Sleeping Expanded - Animations and NPC reactions,,"Ever noticed how NPCs don't react at all to being woken up in the middle of the night? Or how characters stop breathing while they sleep? Or... how it takes them YEARS to get in and out of bed? Well, no more! WAKE UP, JARL BALGRUUF!!!!!!! Sleeping Expanded is here!!!!",,Sleeping NPC's get up faster to fight rather than taking their sweet time allowing the player to kill them,Mod Addition
"Sprint Sneak Movement Speed Fix
",,"Fixes the game applying wrong movement speed if the character draws, sheathes or shouts while sprinting or sneaking. SKSE64 plugin.",,fixes WL-502 - Drawing weapon when stealthed increases speed,Mod Addition
Zero Bounty Hostility Fix,,Clears hostility that remains even after you pay bounty or kill witnesses. Works on vanilla holds only.,,Added - WL-827 - 3 NPCs tried to kill me at different times since Whiterun Sewers,Mod Addition
DLC2TribalWerebearScript Fix,,"Fixes the DLC2TribalWerebearScript to not get stuck running in your save, optimizes it to not get constantly updated unless needed and retroactively stops currently stuck instances, if any exist. No ESP.",,Added for WL-1841 - Scripts Carefully Reworked Optimized and Tactfully Enhanced (SCROTE) - Simply Optimized Scripts AIO ,Mod Addition
Civil War Patrol Bounty Disabled,,"Allows you to attack Civil War patrols without getting bounty.

",,Added for WL-990 - Stormcloacks killing guards in riverwood - I get a whiterun bounty by helping the guards,Mod Addition
Beard Mask fix,,Hides facial hair when wearing items using slot 44.,,"Added for WL-1750 - If you're a male char with a beard, the beard pokes through the masked shrouded cowl.",Mod Addition
Dual Wield Parrying SKSE   ,,"An SKSE-based (.dll file) re-write of my old-school ""Dual Wield Parrying"" mod. C++ instead of Papyrus should give better responsiveness. Also includes a fix for the long-standing ""double attack bug"".",,Added,Mod Addition
Dynamic Weather and Time Based Detection,,"Changes NPC detection depending on the current weather and time of day. During snow, the peripheral and close range vision of NPCs are severely reduced. During rain, NPC hearing is crippled. During pleasant weather, NPC sight and detection range is increased. At night, overall NPC sight is reduced but hearing is slightly increased. MCM included.",,"Added to help with WL-634 - Npcs from riverwood keep following me. specifically, the guards and a horse.",Mod Addition
Word Wall Transparency Fix,,Remove a subtle dark rectangle around word of power on word walls and greybeard shouts for ENB users,,"Fixes WL-1357, Remove a subtle dark rectangle around word of power on word walls and greybeard shouts for ENB users",Mod Addition
Subliminal Traps SSE,,Makes traps blend in more.,,Fix for WL-360 - Traps are visible?,Mod Addition
Potema's Minion Fixlet,,"This should keep the Guardian of Potema's Sanctum where he's supposed to be, allowing the planned dramatic entrance. Optionally, you can change his race from normal Nord (the vanilla one is not a real vampire, despite the displayed name and the attire) to a more appropriate Vampire Nord. ESP-FE",,Added  to fix WL-1882 - Potema's Minion is called a vampire - but isnt actually one,Mod Addition
Spell Research - Spell Composing,,"Spell Composing is an extension of the Spell Research Mod and displays an in-game UI menu to allow you to research spells and automatically crafts all required theses for you
",,Added as part of WL-142 - Spell Research Convenience add-on,Mod Addition
Spell Research Ultimate Add-On Patch,,"Incorporates the following SR improvement/tweak mods into one package:
- Experience Book (plus Enhanced Graphics)
- Convenience Add-On 
- Spell Composing
- Spell Grimoire Patch
- Skyrim Souls RE for SR",,"Adds this mod, and the following list
Experience Book  (SpellResearch_Book v1.7.4 - ESP-FE) 
https://www.nexusmods.com/skyrimspecialedition/mods/28355


Enhanced Graphics for Spell Research Experience Book (to make the above less FUGLY)
https://www.nexusmods.com/skyrimspecialedition/mods/39947

Convenience Add-On 
https://www.nexusmods.com/skyrimspecialedition/mods/28953

Spell Composing
https://www.nexusmods.com/skyrimspecialedition/mods/65756

Spell Research Intuition - Thesis Studying and Recycling
https://www.nexusmods.com/skyrimspecialedition/mods/105064?tab=description ",Mod Addition
Description Framework,,"Adds ability to have descriptions for misc items. 

(Since this just came out, you might want to update these mods to get descriptions to show up)
- Dirt and Blood (Soap, Hair Scissors) - Update to the latest version of the mod.
- Holidays ﻿(Gifts) - Patch available here﻿.
- Campfire ﻿(Mortar/Tents/Cooking Pot...) - Patch available here﻿.
",,"Added for WL-861 - Please fill Descriptions on crafted items that are from Frostfall, Campfire, etc",Mod Addition
mfg fix,,"Fixes ""mfg"" console command and adds some more fixes.",,Added for WL-1298 - MFG Fix,Mod Addition
Enhanced Invisibility,,SKSE plugin that improves and fixes bugs with Invisibility effects,,Added to fix various bugs with invisibility,Mod Addition
TRUEHUD - HUD ADDITIONS,,"HUD additions formerly included in True Directional Movement, completely reworked and improved! Very customizable actor info bars, boss bars, player widget, recent loot log and an API for other plugins to use. Modular and customizable through MCM.",,Added to resolve WL-1655 - Lock on bug,Mod Addition
Tavern Games - Alt Camera Patch,,A quick little fix to tavern games for users of alternate camera mods,,Added to fix some camera issues when using tavern games,Mod Addition
Papyrus Tweaks NG,,"Collection of fixes, tweaks and performance improvements for Skyrim's script engine. 100% configurable. Install/Uninstall anytime.",,Added,Mod Addition
LOD Unloading Bug Fix,,Fixes the bug where LOD objects don't unload if you load an exterior save and fast Travel.,,"Fixes the bug where LOD objects don't unload if you load an exterior save and fast Travel (or use a carriage).

 Added LOD Unloading Bug Fix - Settings Loader as well to save our mcm setting",Mod Addition
Magic Student (WIChangeLocation04) Quest Fix,,Fixes quest objective never disappearing from your quest log,,Fixes quest objective never disappearing from your quest log,Mod Addition
Better Third Person Selection,,"SKSE DLL to overhaul 3rd person object selection. 

Rewrites Skyrim's crosshair selection to work more like true 3rd person RPGs - no more spending 5 minutes picking up tiny gold coins from the ground!",,Added for  WL-1799 - Accidental theft,Mod Addition
Baths for Hearthfire Homes Redone,,A new and improved version of Baths for Hearthfire Homes for Skyrim Special Edition.,,Added bath's to heartfire homes so you can now take a bath (duh) or fill your water bottles with Yummy Bathwater.,Mod Addition
Atronach Friendly Fire,,Friendly conjured atronachs will now heal if you hit them with a spell of the same element!,,Added for WL-916,Mod Addition
Quiet and Silent Dead Thrall Groans and Moans,,"Quiet(er) and Silent Zombie, Reanimated, and Dead Thrall Groans for Conjurers",,Makes Thralls much more quieter.,Mod Addition
