Issue ID,Our Category,Description,Investigation,Resolution,Issue Type
Backported Extended ESL Support,,"Adds support for the extended plugin (ESL) range introduced in game version 1.6.1130 to versions 1.5.97, 1.6.659, and anything in between.

",,Added for WL-1860 - Update Framework & Bugfixes Mods,Mod Addition
Severin Manor Has A price,,"This mod makes Severin Manor available for purchase, after completing the Served Cold quest on Solstheim, instead of being given for free after the quest.",,Added,Mod Addition
Bloodskal Blade - Tweaks and Enhancements,,"This mod fixes several issues with the Bloodskal Blade, as well as expands its usage.",,"Added to fix WL-748 - Bloodskal Blade not working properly, the one that do woosh and send an red magic damage arc fly. ",Mod Addition
Vampire Allies Factions Fix,,A tiny patch to allow the vampires' allies to coexist peacefully. --- ESP-FE,,Added,Mod Addition
Irkngthand's Possible Bugs Fix ,,"I'm told that sometimes Mercer Frey might be missing from Irkngthand Sanctuary, and that the TG08RisingWaterScript might get stuck in infinite loop. These are workarounds. --- ESP-FE ",,Added to fix script issues which make the thieves guild quest chain uncompletable,Mod Addition
DLC2 March of the Dead Fix,,Places Carius' note outside the Ash Spawn so that it's not lost if you don't loot the remains before they disappear. --- ESP-FE,,Added,Mod Addition
Trespass,,"The fort soldiers were displaying erratic behavior about trespassing, attacking my followers even though I'm an ally (and usually when they're mounted, don't ask me why), so I made this to circumvent the issue. ESP-FE",,Added,Mod Addition
Much More Quiet Draugr Shouts,,"Shout files from ""Quieter Dragon Shouts"" by 09jlardinois, with further reduced sound level (-6dB). The original mod is not required but it's recommended, it edits more draugr sounds not included here. No plugin, just audio files.",,Added a gag to the grunts and groans from the undead.,Mod Addition
ENB Light Detection Fix,," SKSE plugin which lets NPCs detect ENB lights for stealth and gameplay, just like other lights. ",,Added,Mod Addition
Driftshade Refuge Unlocked,,"Unlocks a single door in Driftshade Refuge so werewolves can wipe out the Silver Hand during the ""Purity of Revenge"" Companions questline.",,Added,Mod Addition
Mind of Madness Bald Fix,,Stops you getting a fugly hat and bald head equipped in Pelagius's mind.,,Added,Mod Addition
Kill Miraak Spell Fix - Fix for Unlootable and Unkillable Miraak,,"After defeating Miraak, sometimes Hermaeus Mora fails to kill him. Miraak still turns into a skeleton, but keeps floating in the air, and he doesn't actually die. This makes it impossible for the player to take any of his loot. My mod fixes this bug.",,Added for WL-1695 - Miraak won't die,Mod Addition
Item Equip Restrictor,,"SKSE based framework for restricting item equip/spell cast if requirements are not met, using keywords.",,Added for WL-1672 - Horse inventory. Easy to CTD if use it via hotkey (U),Mod Addition
Pelagius Wing - Base Object swapper,,"Base Object Swaps every candle and sconce with their unlit versions, and a optional ESP deletes the embers in the fireplaces.",,"Added so that palaguis wing no longer has lit torches, candles fires or sconces.",Mod Addition
Delete Hawk Nests,,Deletes the floating hawk nests caused by forest mods by replacing the mesh. No world edits. ,,Added,Mod Addition
Sky Reflection Fix,,SKSE plugin which fixes the sky in reflections. ,,Added,Mod Addition
"Requiem - small tweaks SE (knockdown tweak,  Alduin redone and Better forgotten vale).",,"The mods are used to enhance your Requiem experience. Currently here have five mods : knockdown tweak, NPC statefix, VampireCollection, Alduin redone and Better forgotten vale.",,"Added the following tweaks
* Requiem - Alduin Redone 
* Requiem - Better Forgotten Vale 
* Requiem - Knockdown tweak ",Mod Addition
Frostfall - Accessory warmth and coverage fix,,"Fix a bug in Frostfall, a Chesko mod, where accessory warmth and coverage values were set to 0.",,Added,Mod Addition
Master Occlusion Field,,"With many new ""BOSified"" mods, that do not disable references but simply move them down to -30000 Z... A mod is needed to make sure those are not rendered, and guarantee that the claims of performance gains are true. This is it. ",,"Prevents rendering of any objects which have been lowered below the floor, thus increasing FPS",Mod Addition
Mistwatch Trapdoor Fix,,This small tweak fixes an inconsistency with Mistwatch's door design. ,,"Added fix so that the certain double door in one of the towers of Mistwatch places you under a trapdoor when you open it.

As this made little sense, I replaced the double door with a ladder + trapdoor.",Mod Addition
"Gourmet - Cooking Pots and Baking Ovens
",,"Adds cooking pots to every inn that doesn't already have one in the Vanilla game, and adds baking ovens to The Winking Skeever, The Silver-Blood Inn, The Bannered Mare, The Bee and Barb, and The Retching Netch.",,Added for WL-569 -  All cooking stations are missing from the game,Mod Addition
Alchemy XP Fix,,Fixes a bug where you don't get XP for discovering ingredient effects when creating a potion ,,Added,Mod Addition
"Enemy Load Door Travel Fixes
",,"This is a mod that changes some load doors so enemies will follow you through them when using an open encounter zone mod (like Requiem). It fixes several load doors, like the halfway loads of Lost Knife Hideout, or the back door to Embershard Mine.

part of GhoulSmasher's Hyper-Specific Requiem Patches and Tweaks
",,Added,Mod Addition
Crafting Remnants,,"Idea: Player receives remnants as byproducts of the items used for crafting. They don't have to be ""remnants"", could just be any item(s). You decide on the specifics.",,"Added to fix WL-1942 - What's a good way to get empty bottles? It's annoying that recipes requiring bottled water don't give me a bottle back, the whole bottle is consumed, and buying alcohol just to empty it for the bottles is expensive.",Mod Addition
Trad Tweaks Enchantments and Infusions - Wildlander Patch,,Consistency and balance patch for the Enchantments and Infusions Tweak made by Trads2,,Added,Mod Addition
Lurker Breath Attack Restored,,Lurker have a Breath Attack that is unused in vanilla due to some things not being properly set up. This mod reintegrates the ability and fixes some problems with it.,,"Lurker's now have their breathe shout restored. Sorry, not sorry",Mod Addition
Container Item Distributor,,"Add, remove, and replace items and leveled lists to/from containers at runtime à la SPID",,Added framework mod as required by some other R4 Updates,Mod Addition
Droppable Favorites,,Allows favorited items to be dropped from the favorites menu. No esp/scripts. Install/Update/Uninstall whenever. Compatible with everything.,,Added,Mod Addition
Don't Stay in The Water - NPC Water AI Fix,,"A SKSE64 plug-in, fixes the bug that stupid enemies may stay in the water and look at you angrily but just don't come up. ",,Added,Mod Addition
All Keys Descriptions,,"Description for all keys in the game, 394 keys in total, including all add-ons.
Please, don't forget about thumbs up, thank you!",,"Description for all keys in the game, ",Mod Addition
LeveledList Crash Fix for Skyrim 1.5,,Port of LeveledList Crash Fix by SeaSparrow to Skyrim version 1.5.97 ,,"In Skyrim, leveled lists cannot have more than 255 entries. when using scripts to dynamically add things to levelled lists (such as the new container item distributor mods) these can overflow causing a crash. 

This mod prevents that.

Requires original mod, LeveledList Crash Fix with this overwriting.",Mod Addition
Container Distribution Framework,,"Port of Container Distribution Framework by SeaSparrow to Skyrim version 1.5.97 

SKSE framework that distributes items to container references based on rules such as location, reference, count, item keyword etc. ",,Added,Mod Addition
Slaughterfish Fast Travel And Submersion Fix (Stay Submerged AND Non-Hostile When Player Is Not In Water),,"Fixes the frustrating issue where Slaughterfish block fast travel and won't stay submerged. They now stay underwater and won't bother you on land. Download now for smoother, more immersive adventures!",,Fixes the frustrating issue where Slaughterfish block fast travel and won't stay submerged.,Mod Addition
Stuff of Shadows - 3D Nightingale Stone - Nightingale and Twilight Sepulcher Improvements and Bug Fixes,,Improves objects and fixes bugs for Nightingale Hall and Twilight Sepulcher.,,Improves objects and fixes bugs for Nightingale Hall and Twilight Sepulcher.,Mod Addition
Sensible Oculory Solution - Logical Mzark Puzzle - Discerning The Transmundane - Main Quest,,Make the Mzark buttons make sense.,,Added to fix the Mzark buttons,Mod Addition
Grain Mill Animation Fix,,Fixes Grain Mill Animation so it doesn't kick you out after 16 seconds or continue milling when you've left.,,Added,Mod Addition
Predator Vision Power Fix,,Fixes the Thermal Vision power in Gopher's Predator Vision mod.,,Added to fix WL-1864 - I cannot use the Thermal Vision ability after becoming a vampire.,Mod Addition
Non-Exploitable Torches,,"A new and lightweight fix for the torches timer reset exploit, with customizable durations for different timescales via MCM. ELFX compatible.",,Added to fix WL-1808 - Dropping your torch and picking it up again restores the timer for the torch,Mod Addition
Frostfall - Vampire Fix for Vampire overhaul users - Sacrosanct - Better Vampire,,A workaround to enhance Frostfall vampire support. Please read description.,,Added to fix WL-1865 - Vamps not immune to dying of cold exposure,Mod Addition
Standalone Recall Minions,,Adds the recall minions spell from ftweaks. No more losing thralls to bad navmeshes and ai. Works on summons too.,,Added to fix WL-1921 - Recall Minions,Mod Addition
ENB Light Inventory Fix (ELIF),,SKSE plugin that fixes the messed up zoom and rotation of items with ENB particle lights,,Added,Mod Addition
Realistic Camp Storage,,Adds a few campfire containers and patches the campfire script so all that weight doesnt disappear on pickup.,,Added WL-1936 - Barrels and Chests act like minecraft enderchests. ,Mod Addition
Backpack Repositioner - Immersive Equipment Displays,,"A simple solution to make it possible to manage backpacks with Immersive Equipment Displays. Change positioning, rotation, scale, make it invisible with conditions and so on.",,Added for WL-1922 - Add ability to control backpacks Via IED,Mod Addition
Simple Night Robes (Sleepwear),,"Adds a collection of simple night robes, available in several different colors. Optional Sleep Tight NPC integration.",,Added to fix WL-814 - Alessandra be naked.,Mod Addition
Enchantable Special Item Fix for Skyrim 1.5,,Port of Enchantable Special Item Fix by Parapets to Skyrim version 1.5.97,,Added to fix player-made enchantments not appearing on descriptions of special items.,Mod Addition
Locked Empty Container Activate Text Fix,,"SKSE plugin that fixes a vanilla bug wherein if a container is both locked and empty, the activation prompt only displays ""empty"" and not ""locked""",,"Added to fix a vanilla bug wherein if a container is both locked and empty, the activation prompt only displays ""empty"" and not ""locked""",Mod Addition
Horse Save Load Fix,,Fix horse flying into the sky when loading save.,,Added to fix  horse flying into the sky when loading save while mounted.,Mod Addition
Carriage Ferry Travel Overhaul useless dock removal - Base Object Swapper - CFTO - BOS,,Removes a useless pier with floating ropes that NPCs get stuck on due to missing navmeshing. ,,Added - Removes a useless pier with floating ropes that NPCs get stuck on due to missing navmeshing. ,Mod Addition
Requiem - Jail Duration Fix,,"By default in Requiem, the prison sentences you serve are extremely long, resulting in an almost-infinite loading screen. This mod changes the 2 values that Requiem uses to determine the time spent in prison, resulting in a much shorter load.  ",,Added to prevent ILS while serving a jail sentence,Mod Addition
Assorted Vampire Fixes and Tweaks,,"Fixes and tweaks certain aspects about NPC vampires to make your experience more immersive.   

Vampire Scouts Only Attack At Night
Description:
In vanilla, most vampire encounters are scripted to happen during either the night or an eclipse. Except this, and ""Vampire seeking shelter from the sun"". This optional plugin changes that encounter to only happen at night time.
Requirements:
None.

Silverware Remover
Requirements:
Base Object Swapper, AnimObject Swapper.
Description
Removes silver objects(jugs, plates, candlesticks) from all vampire lairs, and replaces them with copper or gold variants (you choose the color during installation). Additionally, it removes the platter that vampire thralls carry and replaces it with a copper/gold variants. 
Originally,this was the ""No more silver in castlevolkihar"" mod. 
Improvementsovertheoriginal:
- Now applies to all vampire lairs, not just castle volkihar.
- Better coloring and shading for both gold and copper variants.

Vampires Sleep In Coffins
Requirements:
None.
Description
Converts some beds to coffins in vampire lairs.
Originally, this was the ""Consistency Fix - Coffins For Vampires"".
Improvements over the original:
- Replacements are no longer their own records. Instead, the original ref is replaced, as it should have been from the start.
- Slight position tweaks.

Vampire Viscera Expanded
Requirements:
Container Distribution Framework
Description:
Uses Container Distribution Framework to add human flesh and hearts into containers in vampire lairs. Vampires are messy eaters, and opening a drawer should be a scary experience.",,Added all Except Silverware Remover as we have a different mod which handles this.,Mod Addition
Exit Sneak On Sprint,,Press your Sprint key to auto-leave Sneak mode and start sprinting.   ,,Added - Press your Sprint key to auto-leave Sneak mode and start sprinting.   ,Mod Addition
Stealth Detection Fixes,,Fixes the player instantly being detected after a stealth kill. Bug is most prominent in heavily modded load orders.,,Added - Fixes the player instantly being detected after a stealth kill.,Mod Addition
Trade and Barter - Settings Loader,,"Created from scratch MCM for Trade and Barter by kryptopyr to support MCM Helper. Saves settings as you change them, automatically loads settings on startup or game load so you don't have to spend time in MCM again with each game. Localization support. No plugin.",,Added for WL-1989 - Trade and Barter - settings keep resetting,Mod Addition
Spell Merchants Sell Spell Research supplies,,"adds spell research supplies - ink, paper, quills etc - to spell vendors inventory",,"Added for WL-2000 - Quills, quills, quills",Mod Addition
Magic Fixes and Tweaks SKSE for 1.5,,"Fixes a few engine bugs with Skyrim's magic, and has a few optional tweaks.",,"Various fixes
* ﻿Gain a small amount of conjuration experience whenever you hit a target with a bound weapon. Also gain a small amount of conjuration experience whenever your Summoned or Reanimated minions hit a target. 
* Extends the duration of certain spells while you are in dialogue. This means that conjuration spells, armor spells, cloak spells, and other reasonable categories will not tick down in dialogue. In order for this to count, the dialogue menu has to be open. If it isn't, you aren't in dialogue.
* Spells that you cast on yourself are no longer absorbed. 
* Beneficial effects are no longer absorb-able. This means spells like Healing Hands, Courage, and Fade Other. While those spells SHOULD be flagged as no absorb, they often aren't (or they are on enchantments, where they cannot be flagged as No Absorb).

 Original Magic Fixes and Tweaks SKSE added with this overwriting.",Mod Addition
Quieter Dead Thralls,,Stops NPCs including Dawnguard vampires and reavers from Dragonborn from saying their default lines when dead thralled,,Makes Thralls much more quieter.,Mod Addition
World Encounter Noble Riding Horse Fix - WERoad02,,Fixes bug where noble abandons the horse,,Added,Mod Addition
Choose Your Own Arch-Mage Aftershock Fix,,This is a fix for a bug in the mod Choose Your Own Arch-Mage which prevented the quest Aftershock from progressing.,,Added,Mod Addition
NPC Block Loop Fix,,"Fixes infinite blocking and over-defensive NPC behavior using only OAR conditions — no scripts, no plugins.",,Added,Mod Addition
Death Idle Fix,,"Fixes a bug where dead NPCs may appear standing or tilted in an idle pose instead of ragdolling after a loading screen. Restores proper physics to affected corpses to maintain immersion. Safe to install or uninstall mid-game. No plugin, no scripts.",,Fixes a bug where dead NPCs may appear standing or tilted in an idle pose instead of ragdolling after a loading screen.,Mod Addition
Synthesis,,A framework and GUI to empower people to create mods via code instead of by hand. Users can run large numbers of these code-based mods and funnel their results into one or more files.,,Added for WL-1860 - Update Framework & Bugfixes Mods,Mod Addition
Legible Item Descriptions,,"A new item card for mods with long item, spell, and power descriptions.
Ever wanted to read a description in Requiem? This mod was made for that.
Information label and value placement have been made consistent and better-aligned for the obsessive-compulsive (me.)",,"Added for WL-1987 - on items where the description is very long, skyui shrinks it until its barely readable",Mod Addition
Flat World Map Framework,,This mod changes default 3D Skyrim map to a flat one.,,Added to restore the flat paper world map that everyone's been missing.,Mod Addition
Skyrim Paper Map by Caro Tuts for FWMF,,Implements paper-like Skyrim map in Map Menu. Drawn by Caro Tuts.,,Added to restore the flat paper world map that everyone's been missing.,Mod Addition
Custom Window,,SKSE plugin which replaces the game window title and icon.,,Added and configured for Wildlander.,Mod Addition
Rumble,,"SKSE plugin which thoroughly reworks and fixes controller rumble, bringing with it a new level of interactivity.",,Added to give better vibrates and rumbles for controller users.,Mod Addition
CoMAP - Common Marker Addon Project,,"CoMAP is an SKSE based framework that allows the adding of custom map/compass marker designs, editing marker discovery music and changing marker assignments without any need for an esp. Ships with a large variety of built in marker types for you to use and premade config files for various mods.",,"Added to give more map markers, and unique icons for each map marker.",Mod Addition
Desktop Splash Screen,,Displays a splash screen while launching the game with SKSE.,,Added,Mod Addition
Discord Rich Presence,,SKSE plugin which adds advanced Discord Rich Presence integration.,,Added,Mod Addition
Hotkey Reminder,, See all your hotkeys with the press of a button. ,,Added to replace the existing Image on F11. This will now enable users to update the f11 reminder if they change their own keybinds,Mod Addition
Menu Zoom,,SKSE plugin that allows you to zoom and inspect items in crafting and magic menus,,Added,Mod Addition
Patreons Menu,,Adds an item under game's main menu to display the Patreon supporters. ,,Added to give a in game patreon list.,Mod Addition
Main Menu Customizer,,"SKSE Plugin that will let you add buttons, interactive text and lists to MainMenu.
Created mainly for modlists.",,"Added and configured for wildlander with links to our Wiki, Reddit, discord, patreon, kofi, the current list version number (which links to the change log), ",Mod Addition
ENB Custom UI Color,,"This is a simple SKSE plugin which makes ENB UI colors customisable, set by default to 3 of the most beautiful shades.",,Added,Mod Addition
CoMAP 4 for Skyrim 1.5,,Port of CoMAP v4 by Parapets and Jelidity to Skyrim version 1.5.97,,"Added to give more map markers, and unique icons for each map marker.",Mod Addition
B.O.O.B.I.E.S (aka Immersive Icons),,"Introducing Beautifully Overhauled and Objectively Better Icons Enriched for SkyUI, (or BOOBIES for short) the ultimate icon experience enhancer!

More item types, more colors, more icons... bring some personality to your inventory",,Added,Mod Addition
Inventory Interface Information Injector (I4),,"Inserts interesting information, including item icons, into inventory interface. Importantly, its innocuous injection implementation intrinsically ignores independently installed interface improvements.",,Added,Mod Addition
Diseases - I4 icon,,"Assigns an appropriate icon to the effects of diseases. Compatible with Survival Mode, Canis Hysteria, Sunhelm, Realistic Needs and Diseases, Immersive Diseases, Last Seed and iNeed. ESP-FE. ",,Added,Mod Addition
I4 Shout Icons Overhaul,,Adds subtle but immersive shout icons to shouts in vanilla and modded skyrim! Now each shout icon will feel unique and special! (Wheeler Supported!) ,,Added,Mod Addition
I4 Weapon Icons Overhaul,,"Adds custom made icons to over 30+ categories of weapons including katana, gun, scythe, crossbow, lance, quarterstaff and more! (Wheeler icons included!)",,Added,Mod Addition
I4 Armor Icons Overhaul,,"Adds custom made icons to over 30+ categories of apparel including wings, skirt, horns, backpack, pouch, cloak, masks and more! ",,Added,Mod Addition
Inventory Interface Information Injector for Skyrim 1.5,,Port of Inventory Interface Information Injector by Parapets and Jelidity to Skyrim version 1.5.97,,Added,Mod Addition
Various Settings loaders for MCM's we edit.,,"R.A.S.S. Rain Ash And Snow Shaders - Wet Frost Cold Dust - Settings Loader
for RASS.

Complete Crafting Overhaul Remastered - Settings Loader
for CCO

Trade and Barter - Settings Loader
Trade & Barter (i think you already added this - but including for completeness)

Cold Region Behavior - Settings Loader
Cold region behaviour

Missives - Settings Loader
Quick Light SE - Settings Loader
Honed Metal -NPC Crafting and Enchanting Services- - Settings Loader (i think you already added this - but including for completeness)
Dynamic Things Alternative - Base Object Swapper - Settings Loader


Mods we plan to add 
LOD Unloading Bug Fix - Settings Loader
Flat World Map Framework (FWMF)
EVG Conditional Idles - Settings Loader


should also go though https://next.nexusmods.com/profile/MaskedRPGFan/mods?gameId=1704 to see what mods we have which have mcm helper / settings loaders",,Added various settings loaders,Mod Addition
Alchemist's Journal,,The journal that shows ingredients and their effects and updates automatically as you learn new effects.,,Added,Mod Addition
Fix Toggle Walk Run (SKSE Plugin),,"This plugin fixes an issue where the Run key gets stuck in the wrong position after opening menus, crossing loading doors, etc, while the Run key is pressed. Compatible with ""Skyrim Souls RE - Updated"".",,Added,Mod Addition
Convenient Reading UI - SE,,"Quality of life improvements for the book menu: 
faster pages animation, configurable text size, configurable bottom bar.",,Added,Mod Addition
Forsworn and Thalmor Lines Expansion,,"Tired of hearing the same lines over and over again? This mod provides new spliced lines to Thalmor and Forsworn, giving them more personality and making each of your encounters with them more unique, personal and unexpected.",,Added ,Mod Addition
Conditional Dog Barking,,"Control what dogs are silent and what dogs can bark in your game and when, where and how often with a help of Dynamic Animation Replacer. Customizable alternative to Quiet Dog animation replacer mod. No esp/esl, just conditional DAR folders with silent .hkx animations for dogs",,Added,Mod Addition
Bandit Lines Expansion,,"Tired of hearing the same bandit lines over and over again? This mod provides 500 new spliced lines to bandits, giving each bandit prototype their own personality and making each of your encounters with them more unique, personal and unexpected.",,Added,Mod Addition
Frostfall Spell Monitor Optimize,,This is a very simple mod to improve Frostfall's spell monitor script to reduce script lag using po3's wonderful Papyrus Extender.,,Added,Mod Addition
Animation Motion Revolution,,This SKSE plugin removes the mismatch between displacement and custom animations caused by limitations in the engine. Welcome to next-gen gaming guys.,,Added,Mod Addition
Dynamic Animation Casting NG,,Framework for new spell casting mods.,,Added,Mod Addition
Animals Swim (Sort of) ,,"Rabbits (and other animals) won't walk at the bottom of the sea anymore, they will float near the surface instead.",,Added,Mod Addition
Don't sheathe bound weapons,,DAR animation mod that changes the way you and NPCs sheathe bound weapons to look like they dissapear instead of being put inside the sheath.,,Added,Mod Addition
Dismiss Steward ,,You can dismiss your steward.,,Added,Mod Addition
DAR - Dynamic Swimming,,Changes the Swimming-Animation depending on Stamina-Level and Armor-Weight.,,Added,Mod Addition
Dark Brotherhood Abduction Redux,,"Prevents Astrid from being able to abduct you with impunity when beginning the Dark Brotherhood questline.
Conditions configurable via MCM. Light Plugin.",,Added,Mod Addition
Food for the Thirsty ,,Get rid of useless food and make a beggar happy... win-win. --- ESP-FE,,Added,Mod Addition
EVG Animated Traversal ,,"A framework to add new animation prompts for the player to climb ledges, squeeze in tight spaces, jump over walls and more.",,Added,Mod Addition
DAR Explorer,,"A tool that allows you to explore, and preview animations added by other mods using Dynamic Animation Replacer (DAR). Now it also allows to create and edit animation priorities and conditions.",,Added,Mod Addition
ENB Lights For Effect Shaders,,SKSE plugin that adds enb lights to all effect shaders.,,Added mod and added Campfire.esm to exclusion ini,Mod Addition
